<!ELEMENT pmcs_and_events (pmcs?,events)>

<!ELEMENT pmcs (pmc*)>
<!ELEMENT pmc (pmc_name,pmc_type,pmc_number)>
<!ELEMENT pmc_name (#PCDATA)>
<!ELEMENT pmc_type (#PCDATA)>
<!ELEMENT pmc_number (#PCDATA)>

<!ELEMENT events (event+)>
<!ELEMENT event (name,descp?,code,flags?,subevents?)>
<!ELEMENT name (#PCDATA)>
<!ELEMENT code (#PCDATA)>
<!ELEMENT descp (#PCDATA)>
<!ELEMENT flags (flag*)>
<!ELEMENT subevents (subevent+)>

<!ELEMENT subevent (subevt_name,subevt_descp?,flags)>
<!ELEMENT subevt_name (#PCDATA)>
<!ELEMENT subevt_descp (#PCDATA)>

<!ELEMENT flag (flag_name,flag_value)>
<!ELEMENT flag_name (#PCDATA)>
<!ELEMENT flag_value (#PCDATA)>
